commit	val_bpb	memory_gb	status	description
exp001	3.979530	6.4	keep	random nas d=6 width=384 heads=4 act=GELU attn=windowed
exp002	3.994410	2.3	discard	random nas d=5 width=160 heads=5 act=ReluSquared attn=full
exp003	3.979607	3.8	discard	random nas d=5 width=288 heads=6 act=ReLU attn=full
exp004	3.982995	7.5	discard	random nas d=8 width=384 heads=6 act=ReLU attn=windowed
exp005	3.982667	4.8	discard	random nas d=6 width=288 heads=2 act=GELU attn=windowed
exp006	3.983851	5.2	discard	random nas d=5 width=352 heads=8 act=GELU attn=full
exp007	3.973551	6.4	keep	random nas d=8 width=288 heads=3 act=ReluSquared attn=windowed
exp008	4.003334	2.0	discard	random nas d=3 width=224 heads=2 act=ReluSquared attn=full
exp009	4.000616	1.8	discard	random nas d=4 width=160 heads=5 act=ReluSquared attn=windowed
exp010	3.982498	11.0	discard	random nas d=8 width=480 heads=4 act=ReluSquared attn=full
exp011	4.023269	1.1	discard	random nas d=3 width=128 heads=4 act=GELU attn=full
exp012	3.996713	9.1	discard	random nas d=8 width=416 heads=2 act=GELU attn=windowed
exp013	3.988266	8.7	discard	random nas d=7 width=448 heads=4 act=ReluSquared attn=windowed
exp014	3.979712	2.8	discard	random nas d=6 width=192 heads=4 act=ReLU attn=windowed
exp015	3.986717	5.0	discard	random nas d=7 width=288 heads=2 act=ReLU attn=windowed
exp016	3.992879	2.8	discard	random nas d=3 width=352 heads=2 act=ReLU attn=full
exp017	3.987004	3.0	discard	random nas d=3 width=352 heads=4 act=SiLU attn=windowed
exp018	3.994982	3.7	discard	random nas d=3 width=448 heads=2 act=ReluSquared attn=windowed
exp019	3.969839	5.8	keep	random nas d=7 width=288 heads=3 act=ReluSquared attn=full
exp020	3.979587	6.5	discard	random nas d=8 width=320 heads=4 act=ReLU attn=full
exp021	3.984352	2.4	discard	random nas d=6 width=160 heads=5 act=ReLU attn=windowed
exp022	3.978806	2.9	discard	random nas d=5 width=224 heads=4 act=ReLU attn=full
exp023	3.980156	3.2	discard	random nas d=5 width=224 heads=7 act=GELU attn=full
exp024	3.988350	2.5	discard	random nas d=4 width=224 heads=2 act=SiLU attn=windowed
exp025	3.980229	3.2	discard	random nas d=7 width=160 heads=5 act=SiLU attn=full
exp026	3.990344	5.3	discard	random nas d=4 width=480 heads=4 act=ReluSquared attn=windowed
exp027	3.991007	9.6	discard	random nas d=7 width=480 heads=2 act=GELU attn=full
exp028	3.999099	2.0	discard	random nas d=3 width=224 heads=4 act=SiLU attn=full
exp029	4.011092	1.5	discard	random nas d=3 width=192 heads=3 act=ReLU attn=windowed
exp030	3.982837	4.5	discard	random nas d=5 width=320 heads=5 act=GELU attn=windowed
exp031	3.978352	4.9	discard	random nas d=7 width=256 heads=8 act=SiLU attn=windowed
exp032	3.981100	8.5	discard	random nas d=6 width=512 heads=8 act=ReluSquared attn=windowed
exp033	3.993029	10.6	discard	random nas d=8 width=480 heads=2 act=ReluSquared attn=windowed
exp034	3.996681	2.5	discard	random nas d=7 width=128 heads=8 act=SiLU attn=windowed
exp035	3.979451	8.0	discard	random nas d=6 width=480 heads=5 act=ReluSquared attn=windowed
exp036	3.990346	5.7	discard	random nas d=5 width=416 heads=2 act=GELU attn=windowed
exp037	3.991255	9.3	discard	random nas d=7 width=480 heads=3 act=ReluSquared attn=windowed
exp038	3.982754	4.5	discard	random nas d=3 width=512 heads=8 act=SiLU attn=full
exp039	3.981168	5.6	discard	random nas d=5 width=448 heads=7 act=ReLU attn=windowed
exp040	3.979772	7.3	discard	random nas d=5 width=512 heads=4 act=GELU attn=full
exp041	3.981761	5.9	discard	random nas d=6 width=352 heads=2 act=ReluSquared attn=windowed
exp042	3.993290	11.3	discard	random nas d=8 width=512 heads=4 act=SiLU attn=windowed
exp043	3.979799	2.2	discard	random nas d=5 width=160 heads=4 act=ReluSquared attn=windowed
exp044	3.985316	6.1	discard	random nas d=5 width=448 heads=2 act=SiLU attn=full
exp045	3.984129	7.4	discard	random nas d=6 width=480 heads=4 act=ReLU attn=full
exp046	3.998300	2.2	discard	random nas d=4 width=192 heads=4 act=GELU attn=full
exp047	4.012309	1.4	discard	random nas d=3 width=160 heads=4 act=SiLU attn=windowed
exp048	3.979788	3.5	discard	random nas d=4 width=320 heads=4 act=GELU attn=windowed
exp049	3.995566	12.2	discard	random nas d=7 width=416 heads=8 act=ReLU attn=windowed
exp050	3.989618	4.2	discard	random nas d=3 width=480 heads=3 act=GELU attn=full
exp051	3.978961	7.7	discard	random nas d=6 width=448 heads=7 act=GELU attn=full
exp052	3.998307	3.5	discard	random nas d=3 width=416 heads=2 act=SiLU attn=windowed
exp053	3.991278	3.4	discard	random nas d=3 width=448 heads=4 act=ReLU attn=windowed
exp054	3.983079	4.5	discard	random nas d=6 width=288 heads=4 act=ReLU attn=full
exp055	3.974876	6.5	discard	random nas d=6 width=384 heads=6 act=ReluSquared attn=full
exp056	3.982435	5.6	discard	random nas d=5 width=448 heads=8 act=ReLU attn=windowed
exp057	3.974870	3.8	discard	random nas d=7 width=192 heads=4 act=SiLU attn=full
exp058	3.978584	4.2	discard	random nas d=4 width=352 heads=8 act=SiLU attn=full
exp059	4.013855	1.4	discard	random nas d=3 width=160 heads=5 act=GELU attn=windowed
exp060	3.991311	4.8	discard	random nas d=3 width=352 heads=8 act=ReLU attn=windowed
exp061	3.988127	3.0	discard	random nas d=3 width=384 heads=8 act=ReLU attn=windowed
exp062	3.989438	6.8	discard	random nas d=6 width=416 heads=2 act=GELU attn=full
exp063	3.984037	4.0	discard	random nas d=5 width=288 heads=2 act=SiLU attn=windowed
exp064	3.986306	2.8	discard	random nas d=5 width=192 heads=8 act=SiLU attn=full
exp065	3.979694	2.7	discard	random nas d=5 width=192 heads=6 act=SiLU attn=windowed
exp066	3.990838	11.1	discard	random nas d=8 width=480 heads=8 act=SiLU attn=full
exp067	3.972254	3.1	discard	random nas d=7 width=160 heads=2 act=ReluSquared attn=windowed
exp068	3.996761	1.8	discard	random nas d=4 width=160 heads=4 act=ReluSquared attn=windowed
exp069	3.983139	8.4	discard	random nas d=6 width=480 heads=8 act=SiLU attn=full
exp070	3.974302	6.6	discard	random nas d=8 width=288 heads=2 act=ReluSquared attn=full
exp071	3.983990	3.2	discard	random nas d=4 width=288 heads=6 act=GELU attn=windowed
exp072	4.008739	1.8	discard	random nas d=5 width=128 heads=2 act=GELU attn=full
exp073	3.993994	2.8	discard	random nas d=8 width=128 heads=8 act=ReluSquared attn=windowed
exp074	3.988094	7.3	discard	random nas d=5 width=512 heads=2 act=SiLU attn=full
exp075	3.980986	5.9	discard	random nas d=8 width=288 heads=6 act=ReLU attn=full
exp076	3.982960	5.9	discard	random nas d=3 width=480 heads=8 act=ReluSquared attn=windowed
exp077	3.987830	6.7	discard	random nas d=5 width=480 heads=4 act=SiLU attn=windowed
exp078	3.969318	5.6	keep	random nas d=8 width=256 heads=4 act=ReluSquared attn=windowed
exp079	3.972498	5.4	discard	random nas d=5 width=384 heads=8 act=ReluSquared attn=windowed
exp080	3.986757	8.4	discard	random nas d=8 width=384 heads=4 act=GELU attn=windowed
exp081	3.987879	3.4	discard	random nas d=7 width=160 heads=8 act=SiLU attn=full
exp082	3.984564	2.9	discard	random nas d=4 width=288 heads=3 act=ReLU attn=windowed
exp083	3.977620	6.4	discard	random nas d=7 width=320 heads=4 act=GELU attn=full
exp084	3.973627	4.3	discard	random nas d=8 width=192 heads=3 act=SiLU attn=full
exp085	3.983541	3.7	discard	random nas d=7 width=192 heads=8 act=ReluSquared attn=windowed
exp086	3.976920	3.2	discard	random nas d=6 width=192 heads=3 act=GELU attn=windowed
exp087	3.988683	6.2	discard	random nas d=5 width=448 heads=4 act=SiLU attn=windowed
exp088	3.978662	4.7	discard	random nas d=7 width=224 heads=8 act=ReluSquared attn=full
exp089	3.976261	6.3	discard	random nas d=7 width=320 heads=2 act=SiLU attn=full
exp090	3.984988	4.0	discard	random nas d=4 width=352 heads=2 act=GELU attn=full
exp091	3.979232	2.7	discard	random nas d=5 width=192 heads=4 act=GELU attn=windowed
exp092	3.978177	5.8	discard	random nas d=7 width=288 heads=6 act=GELU attn=full
exp093	3.983765	5.4	discard	random nas d=4 width=480 heads=5 act=SiLU attn=windowed
exp094	3.976610	5.9	discard	random nas d=6 width=352 heads=4 act=SiLU attn=windowed
exp095	3.986857	3.8	discard	random nas d=8 width=160 heads=8 act=ReluSquared attn=full
exp096	3.988437	9.3	discard	random nas d=7 width=480 heads=4 act=ReluSquared attn=windowed
exp097	3.983337	6.4	discard	random nas d=5 width=480 heads=8 act=ReLU attn=full
exp098	3.982918	7.2	discard	random nas d=8 width=352 heads=4 act=ReLU attn=full
exp099	3.974412	5.1	discard	random nas d=8 width=224 heads=2 act=GELU attn=full
exp100	3.974204	4.5	discard	random nas d=7 width=224 heads=4 act=SiLU attn=full
