commit	val_bpb	memory_gb	status	description
exp001	3.977780	5.3	keep	baseline
exp002	3.973821	5.4	keep	value embeddings on every layer instead of alternating
exp003	3.975207	5.5	discard	replace plain FFN with parameter-matched SwiGLU MLP while keeping all-layer value embeddings
exp004	3.975371	5.4	discard	reduce short attention window from 256 to 128 so local layers are actually local
exp005	3.972923	5.4	keep	increase global attention frequency from SSSL to alternating SLSL with all-layer value embeddings
exp006	3.972646	5.6	keep	switch default attention layout from alternating SLSL windows to full global attention
exp007	3.977545	5.1	discard	halve attention head dim to 32 for 9-head full attention
exp008	3.974447	5.2	discard	switch default full attention to multi-query with 1 KV head and shared value embeddings
exp009	3.973196	6.5	discard	shift full-attention model to 7 layers with aspect ratio 40 to test a deeper-narrower balance at 320 width
exp010	3.973255	5.6	discard	broaden value-embedding gate from 32 channels to full hidden-state conditioning
exp011	3.974081	6.7	discard	widen full-attention all-value-embed model from 320 to 384 hidden size
exp012	3.972407	5.6	keep	reduce full-attention head count from 5 to 4 by widening head dim from 64 to 80 at 320 model width
exp013	3.971664	5.3	keep	switch exp012 full-attention model from 4 KV heads to grouped-query attention with 2 KV heads
exp014	4.392318	5.4	discard	tie input and output embeddings on exp013 full-attention 4-head GQA model
exp015	3.973326	5.2	discard	tighten exp013 full-attention 4-head GQA model to multi-query attention with 1 KV head
exp016	0.000000	0.0	crash	add learnable per-layer scaling on value embeddings in exp013 4-head GQA model
exp017	3.979753	5.3	discard	switch exp013 full-attention 4-head GQA model from ReluSquared MLPs to SiLU activations
exp018	3.973138	4.8	discard	reduce exp013 full-attention 4-head GQA model MLP expansion from 5x to 4x for a faster capacity tradeoff
exp019	3.975940	5.4	discard	replace exp013 plain FFN with parameter-matched SwiGLU MLP
exp020	3.977469	4.4	discard	reduce exp013 full-attention 320-wide 4-head GQA model from 6 layers to 5 to trade depth for faster optimization
exp021	3.982600	4.9	discard	switch transformer blocks to parallel residual attn+mlp branches
exp022	3.971118	5.6	keep	deepen full-attention GQA model to 8 layers while narrowing to 256 width with 64-d heads
exp023	3.969359	6.3	keep	deepen exp022 full-attention 256-wide 4-head GQA model to 9 layers while holding width fixed
exp024	3.972054	7.0	discard	deepen exp023 full-attention 256-wide 4-head GQA model to 10 layers while holding width fixed
exp025	3.976929	6.4	discard	increase exp023 full-attention 256-wide 9-layer model from 4/2 heads to 8/4 heads by using 32-d head size
exp026	3.969111	6.2	keep	switch exp023 full-attention 256-wide 9-layer model from 4-query/2-kv GQA to 4-query/1-kv multi-query attention
exp027	3.968776	6.1	keep	ablate value embeddings from exp026 9-layer 256-wide full-attention MQA model
exp028	3.971186	6.8	discard	deepen exp027 256-wide full-attention MQA no-value-embed model from 9 to 10 layers
exp029	3.969432	6.7	discard	increase exp027 9-layer 256-wide full-attention MQA no-value-embed model MLP expansion from 5x to 6x
exp030	3.975320	6.1	discard	increase exp027 9-layer 256-wide full-attention MQA no-value-embed model from 4 heads to 8 heads by using 32-d head size
exp031	3.969617	6.2	discard	increase exp027 9-layer 256-wide no-value-embed full-attention model from 1 to 2 KV heads to test light GQA
exp032	3.973548	7.0	discard	widen exp027 9-layer 256-wide full-attention MQA no-value-embed model to 288 hidden size with 4 heads
exp033	3.977270	5.9	discard	ablate learned per-layer x0 skip from embeddings in exp027 9-layer 256-wide full-attention MQA model
exp034	3.968439	5.5	keep	reduce exp027 9-layer 256-wide full-attention MQA no-value-embed model MLP expansion from 5x to 4x
exp035	3.968299	5.6	keep	reduce exp034 9-layer 256-wide full-attention MQA no-value-embed model from 4 heads to 2 heads by using 128-d head size
exp036	3.969390	5.0	discard	reduce exp035 9-layer 256-wide 2-head full-attention MQA no-value-embed model MLP expansion from 4x to 3x
exp037	3.972750	5.5	discard	switch exp035 9-layer 256-wide 2-head MQA no-value-embed model from full attention to alternating SLSL with 256-token local windows
exp038	3.968624	5.8	discard	switch exp035 9-layer 256-wide 2-head full-attention no-value-embed model from 1 to 2 KV heads to test 2-head MHA
exp039	3.972601	5.5	discard	reduce exp035 9-layer 256-wide full-attention MQA no-value-embed model from 2 heads to 1 head by using 256-d head size
exp040	4.574585	5.6	discard	tie exp035 9-layer 256-wide 2-head full-attention MQA no-value-embed model input and output embeddings
exp041	3.969576	4.9	discard	narrow exp035 9-layer full-attention MQA no-value-embed model from 256 to 224 width while keeping 2 heads via 112-d head size
exp042	3.969925	6.3	discard	widen exp035 9-layer full-attention MQA no-value-embed model from 256 to 288 while keeping head count low at 3 via 96-d head size
exp043	3.970160	5.6	discard	replace exp035 plain 4x FFN with parameter-matched SwiGLU gated MLP
exp044	3.969424	6.2	discard	deepen exp035 9-layer 256-wide 2-head full-attention MQA no-value-embed model to 10 layers while keeping 4x FFN
exp045	3.973642	5.6	discard	switch exp035 9-layer 256-wide 2-head full-attention MQA no-value-embed model MLP activation from ReluSquared to GELU
exp046	3.969432	5.6	discard	initialize exp035 x0 embedding skip with depth-decayed 0.1->0.0 profile
exp047	3.967951	5.6	keep	keep exp035 multi-query keys but untie value projections across query heads
exp048	3.970264	5.9	discard	re-enable all-layer value embeddings on exp047 9-layer 256-wide 2-head full-attention MQA model with untied value projections
exp049	3.968479	5.6	discard	increase exp047 9-layer 256-wide full-attention MQA model from 2 to 4 query heads by using 64-d heads while keeping untied value projections
exp050	3.968728	6.2	discard	increase exp047 9-layer 256-wide 2-head full-attention MQA model FFN multiplier from 4x to 5x while keeping untied value projections
exp051	3.970058	5.0	discard	reduce exp047 9-layer 256-wide 2-head full-attention MQA model with untied value projections to 8 layers for a faster optimization tradeoff
exp052	3.968470	5.8	discard	untie key projections across heads in exp047 9-layer 256-wide 2-head full-attention model
exp053	3.969033	5.7	discard	re-enable untied value embeddings only in the deepest third of layers on exp047 9-layer 256-wide 2-head full-attention MQA model
exp054	0.000000	0.0	crash	add learned per-head query temperature to exp047 9-layer 256-wide 2-head full-attention MQA model with untied value projections
exp055	3.967987	5.5	discard	rebalance exp047 into a 10-layer 224-wide 2-head full-attention MQA model with untied value projections
exp056	3.969166	5.6	discard	retry exp047 with bounded learned per-layer per-head query temperatures
exp057	3.969254	5.7	discard	re-enable untied value embeddings only in the earliest third of layers on exp047 9-layer 256-wide 2-head full-attention MQA model
exp058	3.969698	5.1	discard	rebalance exp047 into an 11-layer 192-wide 2-head full-attention MQA model with untied value projections
exp059	0.000000	0.0	crash	add learned hidden-state RMSNorm gains to exp047 9-layer 256-wide 2-head full-attention MQA model with untied value projections
exp060	3.970475	5.8	discard	rebalance exp047 into a 10-layer 240-wide 2-head full-attention MQA model with untied value projections
exp061	3.977883	5.2	discard	ablate query-key RMS normalization in exp047 9-layer 256-wide 2-head full-attention MQA model with untied value projections
exp062	3.973036	5.5	discard	switch exp047 from full attention to alternating half-window local/global attention
exp063	3.968240	6.2	discard	deepen exp047 256-wide 2-head full-attention MQA model with untied value projections from 9 to 10 layers
exp064	3.972495	5.8	discard	switch exp047 9-layer 256-wide 2-head full-attention MQA model with untied value projections from ReluSquared FFN to parameter-matched SwiGLU
exp065	3.969589	5.6	discard	add RMSNorm on FFN hidden activations in exp047 9-layer 256-wide 2-head full-attention MQA model with untied value projections
exp066	3.966638	5.6	keep	hybridize exp047 value projections by keeping MQA shared values in early layers and untied per-head values only in deeper layers
exp067	3.968123	5.6	discard	delay untied per-head value projections until the deepest third of layers on the exp066 hybrid-value model
exp068	3.968453	5.6	discard	move exp066 hybrid value-head transition earlier so only the earliest third of layers keep shared MQA values
exp069	3.967636	5.8	discard	enable value embeddings only in the untied deeper half of the exp066 hybrid-value model
exp070	3.969623	5.7	discard	enable value embeddings only in the early shared-value layers of the exp066 hybrid-value model
exp071	3.969040	6.2	discard	deepen exp066 hybrid-value full-attention 256-wide 2-head model from 9 to 10 layers
exp072	3.967843	5.7	discard	untie key projections only in the deeper half of the exp066 hybrid-value model
exp073	3.969269	5.5	discard	rebalance exp066 hybrid-value full-attention model to 10 layers and 224 width while keeping 2 heads
exp074	3.967960	5.0	discard	reduce exp066 hybrid-value model FFN expansion from 4x to 3x
exp075	3.966628	5.6	keep	increase exp066 hybrid-value full-attention model from 2 to 4 query heads while keeping shared early values and untied deeper values
exp076	3.977529	5.5	discard	increase exp075 hybrid-value full-attention model from 4 to 8 query heads while keeping shared early values and untied deeper values
exp077	3.967587	5.7	discard	untie key projections in the deeper half of exp075's 4-head hybrid-value model while keeping shared early MQA keys
exp078	3.968113	5.5	discard	group deeper-half values into 2 groups on exp075 4-head hybrid-value model
exp079	3.969153	5.6	discard	switch exp075 4-head hybrid-value full-attention model from 1 to 2 KV heads to test grouped-query keys
exp080	3.968332	5.7	discard	enable learned value embeddings only in the deeper untied half of the exp075 4-head hybrid-value model
exp081	3.968519	5.6	discard	move exp075 4-head hybrid-value model transition earlier so only the earliest third of layers keep shared MQA values
exp082	3.967877	5.6	discard	ramp hybrid-value heads across depth from shared MQA to 2-group middle layers to fully untied deeper layers on exp075
exp083	3.968524	5.6	discard	delay exp075 4-head hybrid-value model transition so only the deepest third of layers use untied per-head values
exp084	3.967721	5.6	discard	shift FFN capacity toward the deeper untied-value layers by using 3x expansion early and 5x expansion late on the exp075 hybrid-value 4-head model
exp085	3.971922	6.2	discard	widen exp075 hybrid-value full-attention 4-head model from 256 to 288 hidden size while keeping shared early values and untied deeper values
exp086	3.969505	6.1	discard	increase exp075 4-head hybrid-value full-attention model FFN expansion uniformly from 4x to 5x
exp087	3.969399	5.6	discard	zero-initialize x0 residual skip coefficients on the exp075 hybrid-value 4-head full-attention model
exp088	3.966099	6.1	keep	add learned per-layer attention and MLP residual gates on the exp075 hybrid-value 4-head full-attention model
exp089	3.965910	6.1	keep	constrain exp088's per-layer attention and MLP residual gates to positive sigmoid scales
exp090	3.968883	6.1	discard	constrain exp089 residual stream and x0 skip mix coefficients to positive sigmoid scales
exp091	3.967797	6.1	discard	constrain only the x0 embedding skip coefficients to positive sigmoid scales while keeping exp089's unconstrained residual stream mix
exp092	3.966697	6.1	discard	constrain only exp089 residual stream mix coefficients to positive sigmoid scales while keeping x0 skips unconstrained
exp093	3.967544	6.1	discard	initialize positive attn/mlp gates with a depth-shaped profile: earlier layers start slightly attention-heavier and deeper layers slightly MLP-heavier
exp094	3.974048	5.6	discard	switch exp089 gated hybrid-value full-attention model MLP activation from ReluSquared to ReLU
exp095	3.971981	6.0	discard	rebalance exp089 gated hybrid-value full-attention model to 10 layers and 224 width while keeping 4 heads
exp096	3.968528	6.1	discard	shift FFN capacity toward the early shared-value layers by using 5x expansion early and 3x expansion late on the exp089 gated hybrid-value 4-head model
exp097	3.966623	6.2	discard	reduce exp089 gated hybrid-value full-attention model from 4 query heads back to 2 while keeping positive per-layer attention and MLP branch gates
exp098	3.966100	6.1	discard	replace exp089's capped sigmoid attention/MLP branch gates with uncapped softplus-positive scales that keep unit initialization
exp099	3.965618	6.2	keep	give the deeper half of exp089's gated hybrid-value model 2 grouped-query key heads while keeping early layers on shared MQA keys
exp100	3.967871	6.2	discard	delay exp099 deeper grouped-query key transition so only the deepest third of layers use 2 key heads
